ProductID,Name,Description,CategoryID,UnitPrice,StockQuantity
491,Water Tanks,Center thus reflect agreement management thousand shake. Challenge market bad west religious.,4,78.26,583
492,Agricultural Product,West just sort mission pattern. Need life staff want argue enough new.,4,34.17,477
493,Water Tanks,Open which down. Fund hope else a.,3,54.32,602
494,Water Tanks,Clearly painting month business. World lot relate owner major tell. Bed activity relationship full.,2,87.77,737
495,Water Tanks,Customer civil mouth growth step boy teacher.,1,21.39,656
496,Industrial Product,Treat pattern base site give. Admit offer while hand while so.,3,46.68,420
497,Cleaning Product,Set meeting meet pull piece. Especially none listen fall site must teach. Similar pick stop early.,2,74.99,568
498,Industrial Product,Dinner federal scene thing go southern. About movement our dark. Vote field issue support.,4,55.48,833
499,Plumbing Product,Debate prove north future. Room minute thousand down.,3,56.36,895
500,Industrial Product,Child seem camera tough.,3,57.96,221
