ProductID,Name,Description,CategoryID,UnitPrice,StockQuantity
247,Agricultural Product,Fire manage experience necessary perform let. Indicate large officer water teacher.,1,87.21,927
248,Agricultural Product,Sport management want rest yet officer technology ability. Name growth response exactly subject.,2,29.06,750
249,Agricultural Product,All process mouth. Catch case community.,3,67.81,166
250,Agricultural Product,Sea true ground social thus. Challenge law budget lead skin less between reveal.,4,39.31,470
251,Industrial Product,Nature do center describe their pass.,2,22.02,452
252,Agricultural Product,Occur body scientist development reality rock technology that. Poor arm want ago.,1,99.76,535
253,Plumbing Product,Fall which because situation. Force trade local region describe among world material.,3,40.21,207
254,Water Tanks,Benefit prevent entire society. Vote those media war. Who account speech figure safe certainly.,4,42.41,309
255,Cleaning Product,Southern game animal. Real know court she.,4,74.38,806
256,Cleaning Product,Center energy develop. Alone support half police sense. New space candidate read.,4,26.72,606
257,Water Tanks,Drop season or region somebody.,4,48.3,824
258,Plumbing Product,Another realize seven myself subject watch simple. Actually painting life draw.,3,24.99,728
259,Agricultural Product,Provide visit talk which. Employee interest mind by total employee. Activity top example box.,2,48.45,150
260,Agricultural Product,"Less share hand others.
Different leg page create. Find media want.",4,47.42,322
261,Agricultural Product,Foot last onto charge.,1,21.34,485
262,Industrial Product,Ask physical majority thank different city. Themselves scientist these view because.,3,93.71,79
263,Water Tanks,Reach south computer understand security with. Must recently television oil more us.,1,14.54,570
264,Plumbing Product,Behind quickly mention spring. Price cultural area write before. Result work through.,4,55.32,875
265,Water Tanks,Speech pattern show play accept tax front reveal.,4,51.83,596
266,Agricultural Product,Former data impact base world. Almost loss whole what.,4,63.61,109
267,SANITARY PRODUCT,President with rich impact quickly design trip author. Outside must single television station eye.,2,56.03,497
268,Industrial Product,Form true issue before plant head stage. Meet if but successful. Choice letter military one.,1,77.91,879
269,Agricultural Product,Such amount positive really term federal. Institution experience man measure back baby however I.,2,76.99,281
270,Industrial Product,Situation successful choice. Range section world fine. Someone admit tree.,3,62.27,808
271,Agricultural Product,Manager manage card at. Meet perform unit support actually around art.,4,95.19,486
272,Industrial Product,Prove analysis detail bank success. Rate the his suffer wrong because skill thought.,3,28.97,865
273,Plumbing Product,Arrive difficult view artist know society. Science surface today drop. Republican fly focus.,4,17.11,882
274,Agricultural Product,Book every including five his every. Interesting tough painting house low.,1,85.04,426
275,Plumbing Product,These toward church investment hear sort from. Term lay fly generation officer the tell.,3,17.52,272
276,Cleaning Product,Concern himself take water majority. Include another box truth upon.,3,46.76,993
277,Plumbing Product,Law visit institution international without. Be under executive resource coach serve kitchen.,1,43.7,715
278,Industrial Product,Full meet image rather personal. Republican movie business. Capital lead dog spring suggest father.,4,21.48,845
279,Agricultural Product,Page religious different lead drug store. Significant race which left bring few five.,3,90.67,893
280,SANITARY PRODUCT,Possible guess section former attorney. Discussion high forget. Dog go mention interview kid.,3,66.12,46
281,Industrial Product,Suggest change whatever her. Great option buy.,3,78.27,760
282,Agricultural Product,Box drug compare economy where work. Thought try necessary toward back under not.,4,58.53,414
283,Plumbing Product,Increase increase grow American. Six month who fall seek per bar. Play group memory bank.,4,52.19,196
284,SANITARY PRODUCT,Listen tell produce notice benefit. Feel tend trade.,2,70.61,232
285,Plumbing Product,Prove easy case city.,3,59.32,312
286,Water Tanks,Responsibility able leave whom operation magazine.,3,39.45,234
287,Cleaning Product,"Drop concern improve community.
Skin evidence test win five top. Medical other town few attack.",1,25.68,333
288,Industrial Product,Kitchen threat body nearly level morning. Agent finish unit group southern close marriage.,4,39.25,534
289,Agricultural Product,Nice these society southern piece order. Prove about through forget. Who finally describe together.,4,84.46,855
290,Agricultural Product,Attorney president weight much situation house finish. Its crime eye factor focus test cover.,1,45.59,63
291,Plumbing Product,Service word think develop star civil. East poor worker sell table.,3,61.54,467
292,Agricultural Product,Positive whole television time other. Table pattern two they thank radio.,2,26.74,891
293,SANITARY PRODUCT,That class how play statement follow model.,4,20.8,777
294,Water Tanks,Executive nice believe cell. Shoulder read six sure.,4,72.92,442
295,Agricultural Product,Be floor culture report second.,3,12.99,801
296,Industrial Product,Radio could under society role mouth. Listen choose thought hotel interview rest.,1,33.62,121
297,Agricultural Product,Carry view nice magazine. Accept none administration pressure produce another.,2,36.66,683
298,Plumbing Product,Realize such fear economy care. Station health sing bill.,3,57.15,560
299,Agricultural Product,This offer sister seven hope. Open increase inside case. Sure field money kitchen field.,4,15.97,926
300,Industrial Product,Light five computer suggest hot mouth loss. Individual group the reveal decide entire control gas.,4,40.8,682
301,SANITARY PRODUCT,Tell goal consumer decision. Pick full begin system tonight newspaper economic.,2,48.68,341
302,Cleaning Product,Physical speak son different thank character nearly.,2,70.8,606
303,Cleaning Product,Stop community industry everything two care. Cell set address impact.,1,15.87,858
304,Industrial Product,Audience car child indeed. Space allow wonder building move like down popular.,4,90.1,89
305,Water Tanks,Together financial special. Life health easy.,2,81.01,770
306,Industrial Product,Marriage since pressure hospital. Full picture either five bar out.,2,36.63,524
307,Industrial Product,Paper himself reality. Sort seek whose order president move.,1,69.72,651
308,Industrial Product,Mission develop people education executive list another join.,2,66.94,410
309,Cleaning Product,Whole amount when senior lawyer. Bar audience together direction move major brother.,2,29.23,519
310,Cleaning Product,Article on the should believe food. Rather positive knowledge always. Under million oil.,2,71.87,5
311,SANITARY PRODUCT,Politics tree traditional fish outside check good. Green responsibility perhaps purpose let family.,1,22.28,547
312,Industrial Product,Computer could memory school several standard participant. Push turn mention her hair nearly.,2,65.81,656
313,Industrial Product,Both through professional election win. Experience usually be result dark movie.,4,36.73,948
314,Agricultural Product,Hand just likely so. Image really deal eat live himself inside rule.,2,89.8,492
315,Industrial Product,To answer area example military arrive. Modern record bring say especially health.,4,40.38,805
316,Plumbing Product,Term benefit grow almost kitchen. Five certain leg standard employee expert.,1,31.39,238
317,SANITARY PRODUCT,Ground behind treat require another. Break American bed choose indeed.,1,46.47,294
318,Plumbing Product,Hand may thing party clearly put. Around case then exactly environmental.,1,91.16,616
319,SANITARY PRODUCT,Get often child much people trouble easy. Year attack moment.,4,25.77,305
320,Agricultural Product,Issue actually political hit decide them maybe. Accept big reflect attention bag tend leave.,3,17.2,166
321,Agricultural Product,Sit buy year. Bad name choice. Company though cause benefit few right source position.,2,87.6,540
322,SANITARY PRODUCT,Choose teacher listen child. Begin teach certainly glass.,2,83.94,263
323,SANITARY PRODUCT,Particularly there mind far trade.,1,91.45,435
324,Plumbing Product,Appear media brother house degree positive over window.,4,40.41,649
325,Water Tanks,Tv either small certainly fast. Keep the ready road value. Onto worry my population.,4,40.58,813
326,Cleaning Product,Organization piece sing room some. Talk rest if old true easy. Because market international.,3,69.52,542
327,Industrial Product,"Center task their particularly difference truth case. South put form point.
These peace forward.",3,36.18,445
328,Industrial Product,Across score bit situation. Economy seat response amount three piece.,1,45.21,87
329,Agricultural Product,Bar say watch mouth because national. Coach yeah fund continue clearly form.,4,85.42,828
330,Agricultural Product,North research among project show. Series message hair rule even. Consider theory one.,1,60.49,678
331,Agricultural Product,Treat field grow then fire study billion off. Group of behind scientist heavy go benefit.,3,56.64,40
332,Cleaning Product,Husband no choice several south ask. Growth bill can discover face.,2,73.72,92
333,Cleaning Product,Our prove include pass likely agreement.,4,27.95,724
334,Water Tanks,Store her cold popular.,2,87.55,365
335,Agricultural Product,Impact add impact indeed see attack buy. Theory size deal wind town. Republican white be Democrat.,3,46.81,407
336,Agricultural Product,"Article home seat.
Include record whether production data. Enter by catch if edge today black yes.",4,34.3,779
337,Cleaning Product,Practice media computer drop director yes feel growth. Center against whole shake blood your.,3,62.57,242
338,Industrial Product,Oil tonight court somebody generation imagine. Recently one write wear international ok much.,4,66.92,631
339,Cleaning Product,Fund sometimes customer car arm. Hundred occur different bed myself vote. Sense nor carry nor sign.,4,21.14,241
340,Plumbing Product,Last dinner simply expert style visit. Us big talk word authority. Mrs center leg prevent.,2,82.5,709
341,Plumbing Product,Fear Republican large marriage week hair.,4,67.32,345
342,Plumbing Product,Cultural edge imagine season run. Benefit my show impact my rather.,3,37.86,376
343,Water Tanks,Woman instead easy. Must design security hear forward military.,3,99.28,700
344,Industrial Product,End peace my difficult. Actually huge fill rule course.,2,78.91,199
345,Water Tanks,Open example deep green. Just by tell space record outside plant. Doctor technology worry western.,1,69.88,793
346,Plumbing Product,Pm cell answer look interest. Company drive fire lot spend. Second suggest general.,1,11.34,432
347,Cleaning Product,Develop impact citizen contain. American if meet protect forget enter.,4,19.73,81
348,SANITARY PRODUCT,Air note even thus. Lose contain involve defense really. Summer answer young bring best.,4,74.31,811
349,Water Tanks,Determine short determine certainly type. Guess course day simply. Budget man raise.,1,48.34,161
350,Industrial Product,Fly decision clearly middle interesting challenge. Politics must which assume.,1,43.21,585
351,Agricultural Product,Measure worry want detail religious. Key Republican hard road.,3,83.02,351
352,Water Tanks,Social voice response east smile policy.,2,25.27,532
353,Plumbing Product,Friend impact pay.,1,30.0,875
354,Plumbing Product,Site accept opportunity debate. Everybody camera enter at heart live wife.,2,14.83,743
355,Agricultural Product,Picture indicate responsibility. Under great standard next. Marriage similar eye their American.,1,39.7,819
356,Industrial Product,Tend computer who direction not deep.,4,87.73,69
357,Industrial Product,Away perhaps either few. Strong we final today town.,3,33.64,118
358,Agricultural Product,Effort pay area. Throughout five let character science fund technology budget.,3,13.43,625
359,Plumbing Product,Positive any main social finally. Pressure together alone back its result government.,3,67.9,883
360,Cleaning Product,Set important power cup. Paper inside road use crime next result.,3,77.1,533
361,Plumbing Product,Test various trip health.,3,43.21,995
362,Agricultural Product,Race fact out cold personal himself stand. Well how floor key themselves group media.,4,22.34,822
363,Cleaning Product,Individual heart decision natural. Benefit send year than different among.,3,48.8,665
364,Plumbing Product,Of machine truth million. Some indicate agree pull quite.,4,85.52,560
365,Water Tanks,Magazine look sound impact.,3,42.84,614
366,Agricultural Product,Respond attack agent need involve. Street call hour over. Sound without financial day city.,1,26.15,305
367,Water Tanks,"Lose attention Republican training look firm. Office cold yard.
No agree brother point focus price.",4,29.7,190
368,SANITARY PRODUCT,Discussion pass image account hit. Rock major born brother all protect.,2,44.39,876
369,Cleaning Product,Stay within hold site. Front true every recently our respond. Hair different director part.,4,33.81,32
370,Cleaning Product,Common defense speak remember service. Conference phone country.,3,77.4,411
371,Plumbing Product,Test care teach ok. Single process outside movement. Political place speech.,3,98.64,470
372,Agricultural Product,Task pattern democratic that follow. Simple everyone collection experience.,1,95.1,801
373,Cleaning Product,Think light of first foreign. Hundred part including small shoulder.,1,76.3,118
374,Industrial Product,Particular table me large. Accept to audience pattern bank series miss culture.,1,22.06,452
375,Water Tanks,Go relate suddenly PM suggest raise yard.,3,10.15,423
376,Agricultural Product,Reason TV color three final growth. Discuss politics safe leader. Wear administration center per.,3,25.37,191
377,SANITARY PRODUCT,Manage fly such. Administration decision population later agreement bring.,4,88.12,622
378,Cleaning Product,Shake evidence science result particular four.,3,71.87,922
379,Plumbing Product,Someone other end no now. As wall hour attack computer process herself.,2,75.35,441
380,Water Tanks,Experience say wrong tough Congress turn. Out only citizen.,2,73.19,619
381,Water Tanks,Air set positive large oil his wish fight. Central writer fund institution of majority paper.,4,69.52,356
382,Cleaning Product,Actually when concern particular. Response nature left. Mrs poor play improve test.,3,70.87,708
383,Agricultural Product,On though deep recently. Particular yes affect cold. Good newspaper head blood.,4,70.42,360
384,Agricultural Product,Table century apply first good room general.,4,33.85,359
385,Plumbing Product,These bit professional single grow. Beyond blood adult my actually produce.,3,59.28,443
386,Cleaning Product,Majority day growth where thousand.,3,70.45,441
387,SANITARY PRODUCT,Family sea mind loss on be world. We probably avoid. Employee catch dark effort sister.,4,28.57,407
388,SANITARY PRODUCT,Article drug international call check ten. Red economy throw listen between around various.,4,67.91,359
389,Cleaning Product,Magazine set she nice. Not material require would meet model city.,3,51.64,733
390,Agricultural Product,Me change agency among able either happy.,3,69.59,825
391,Industrial Product,Piece which only by. Near important result. Almost though summer military most.,4,10.89,75
392,SANITARY PRODUCT,Activity happen kitchen field kind. Be nice good particularly.,4,22.14,973
393,Cleaning Product,Down majority between country floor every. Gas right blue strong trade.,1,91.76,177
394,SANITARY PRODUCT,"Plan traditional result push.
Relate interest happy likely upon mind. Even news keep form.",1,17.59,956
395,Industrial Product,Increase chair despite seat and various teach deal.,4,24.29,792
396,Water Tanks,Note old well reduce meeting stand certainly. Away so top best million guy.,4,16.6,287
397,Industrial Product,Plan these say all.,4,12.22,812
398,SANITARY PRODUCT,Store trial provide page north. Yeah cut if third resource account find.,2,12.16,730
399,Water Tanks,Raise imagine idea the growth born respond after. Office many it coach.,1,73.68,817
400,Plumbing Product,Do form measure any by especially. It key body politics within gas road.,1,89.26,31
401,Plumbing Product,Market well card lay. Discover yes less. Try simple business option kitchen discover check.,1,76.57,394
402,Water Tanks,Real leader art it action. Writer listen floor debate.,4,57.48,664
403,Water Tanks,Data already book always conference one. House character since out ahead size. Ball just maintain.,1,76.32,562
404,Cleaning Product,West over maybe long. Now could several foreign. See little point.,4,79.71,935
405,SANITARY PRODUCT,Perhaps end manage much rich down. Keep PM church order.,4,92.85,899
406,Industrial Product,Often prepare drug gas you. Find watch no accept.,4,71.49,905
407,Agricultural Product,Enjoy PM kind hope little yard keep forget. Keep relate do heavy only nothing.,4,59.11,694
408,Cleaning Product,Today low station throughout case day. Senior nor economic Democrat same down.,3,68.11,963
409,SANITARY PRODUCT,Win cultural represent director tend wear image. Guess summer local office become man.,1,42.7,175
410,Cleaning Product,Cell report since image miss cell. Hold blue son remember participant professional type.,4,28.63,683
411,Cleaning Product,Serve school guy human country few doctor. Material would majority.,1,85.06,745
412,Industrial Product,Medical senior performance power. Protect single customer least worry option red.,3,12.72,198
413,Agricultural Product,Kitchen way social. Machine you bank material produce piece determine course.,1,40.49,1
414,Water Tanks,Capital and provide help. Actually Mrs Mr certain. Cut consumer yes oil truth then majority buy.,2,71.29,538
415,Plumbing Product,Operation discuss cut miss free former before.,2,40.34,469
416,Cleaning Product,To finally continue television on stuff evidence. Discuss even natural law local number such.,3,92.28,527
417,Agricultural Product,Indeed sometimes space here. Majority hot the church event stock.,1,95.69,357
418,Water Tanks,Safe look investment continue.,4,13.82,787
419,Water Tanks,Listen should truth a exist.,2,80.15,954
420,Agricultural Product,Employee within character never design. Rest oil quite analysis page growth soon use.,3,62.55,877
421,Cleaning Product,Skill feel pattern hand present view. Occur size wear environment participant have.,3,60.08,540
422,Water Tanks,Them understand eight practice. Rest enjoy mention adult. A agree campaign place.,1,89.04,972
423,SANITARY PRODUCT,Reduce response usually important hand.,4,37.62,891
424,SANITARY PRODUCT,Foot be deal cover community. Spring far adult seven rise.,1,71.67,579
425,Water Tanks,Often almost ball likely respond night. Language quickly news art.,1,46.15,647
426,Industrial Product,Republican science writer heart seek. Long sing buy. Authority help over job pattern child officer.,2,29.41,6
427,Water Tanks,Industry growth stage people chair tend.,2,87.63,828
428,SANITARY PRODUCT,International recent drive want four. Push those economic accept.,1,74.42,1
429,Agricultural Product,Strong couple know husband. Foot price travel song assume age chance.,1,27.79,422
430,Industrial Product,Back perhaps item until her. Hope something again. Brother remember remember truth true after.,1,45.09,231
431,Cleaning Product,Situation race idea actually itself. Officer oil mean rise color.,3,44.26,840
432,Cleaning Product,East play theory know. Prove begin down community organization edge truth.,1,89.81,874
433,Agricultural Product,Machine play region morning.,3,41.74,453
434,Plumbing Product,But common plant move standard high floor. Player game meeting where always.,3,12.94,897
435,Industrial Product,Probably subject piece not low. Meet admit manager her perhaps step.,3,78.0,93
436,Agricultural Product,Call cultural available practice ever machine in. Order traditional left break director.,1,97.22,304
437,Plumbing Product,Natural hour manager shoulder room. Believe country lay month finally consumer.,1,82.09,713
438,Cleaning Product,Relate computer return firm. Culture low strategy direction note fact.,1,82.13,354
439,Plumbing Product,Test all too nearly could back. Their character good physical year interest coach.,2,64.25,668
440,Agricultural Product,Take behavior hope simple. Structure alone end sell. Number tough prevent type.,4,24.41,647
441,Water Tanks,Against choice wrong I but international. Minute service news risk people fall. Memory do them.,1,21.02,231
442,Agricultural Product,Share student fine direction. Hand material perform hair around heart here.,3,40.96,724
443,Cleaning Product,Church political son somebody fall.,4,80.2,545
444,Plumbing Product,Affect situation writer one company true case father.,3,48.83,862
445,Industrial Product,Political management various show. My no write treat religious. Property future office on.,3,30.72,900
446,Water Tanks,Full both never you community medical protect. Pressure cultural until cold.,2,83.14,741
447,Agricultural Product,Firm suggest instead how. Above series decision.,1,68.39,981
448,Plumbing Product,Send make story right throughout hotel. Conference seat list easy article whole great.,2,72.23,807
449,SANITARY PRODUCT,Now song visit specific car policy. Book page call near itself.,1,17.69,935
450,SANITARY PRODUCT,Moment skill phone appear. Painting resource seat or stop why.,4,29.49,206
451,SANITARY PRODUCT,"Able heart as.
Large message clearly spring forget capital them. Direction give car seem.",4,17.63,483
452,SANITARY PRODUCT,Cost gas or picture near us like. Cold suggest against.,1,30.69,198
453,Industrial Product,Scientist save blood seven job state. Decide over tax hotel pass.,1,74.5,903
454,Plumbing Product,Effort fact poor worry reduce or natural. When the across save mission clear.,4,14.18,532
455,Agricultural Product,Cold stage gun own positive. Expect letter push she hard. Study beat course minute structure seem.,1,36.65,435
456,Plumbing Product,Group civil yet. Its eat notice spend popular.,2,31.12,127
457,Plumbing Product,Investment arm side write. Color check far treatment way.,3,93.29,122
458,Agricultural Product,"Outside fund against me.
Risk charge sense wait. Finish together certain hotel police.",3,77.6,163
459,SANITARY PRODUCT,Friend only catch try believe standard eye. Compare out here walk describe.,3,10.08,922
460,Industrial Product,Place down sense suddenly remember management. Hundred east concern.,4,87.88,461
461,Cleaning Product,Firm vote expect place. Either again involve head tax nation TV.,2,72.35,68
462,Cleaning Product,Than land threat spend. Foot impact speech respond room also.,4,87.08,940
463,SANITARY PRODUCT,Contain message question skin. Doctor wall image himself whole probably.,2,85.26,843
464,Plumbing Product,Then two eye natural join race. After newspaper but structure sea subject together.,2,50.81,411
465,Plumbing Product,Find material rest financial report from effect. Company common draw mention tree.,3,73.67,939
466,Cleaning Product,Writer eye executive floor room nearly happen. Party last get music wife theory do.,2,20.31,705
467,Agricultural Product,Away language member. Cut deal party bar. Night outside artist fire.,1,43.12,161
468,Water Tanks,Forget scene discussion challenge. Such new wide establish behavior husband night.,4,44.2,870
469,Plumbing Product,Mention strategy final who check. Issue my year would arm. Staff pick sign fund guy summer.,4,93.95,548
470,SANITARY PRODUCT,Movie soldier believe suggest none gun. Bill against house cost.,3,87.32,25
471,Plumbing Product,Not must step their. Pretty south dream specific agree tax strong heavy. Cup hundred kid.,4,55.03,796
472,Water Tanks,With respond billion try myself. Move actually understand degree common.,4,65.52,962
473,Agricultural Product,Car whom traditional including learn.,4,36.89,188
474,Industrial Product,Authority yard each main particular baby. Machine provide it step idea.,4,66.8,63
475,Agricultural Product,"Thousand green radio win write.
Avoid up door too.",1,42.94,363
476,Cleaning Product,Television bit argue new.,2,60.74,426
477,Cleaning Product,Early beat resource. Woman defense skill price staff believe. Nation heart sure keep.,2,55.26,275
478,Agricultural Product,Or general nature cover reason half. Fast put me structure born money course exactly.,1,42.13,426
479,SANITARY PRODUCT,Science yes no professor yourself business outside. Season use reduce hear past human value expert.,4,76.86,903
480,Agricultural Product,Thank relate herself. Course ago approach late plan why including other.,4,14.42,960
481,SANITARY PRODUCT,Subject tree paper read agency like. System tonight impact likely return though apply school.,4,82.29,26
482,Industrial Product,Near mean you weight push. Effect cause treat effect. Work something yard under of.,2,16.12,256
483,Agricultural Product,Local score create peace concern practice. Job each nearly at. Partner current board end Mr.,2,46.07,50
484,Water Tanks,Understand one open ten specific sister. Enter various who offer. Record second sign live chance.,1,79.26,268
485,Water Tanks,Out conference page. Expert capital return half.,2,51.87,161
486,Cleaning Product,About fast term. Nature cup many city.,4,93.24,501
487,Water Tanks,"Ready reason during usually support.
Camera difference of heavy billion over.",2,71.76,932
488,Industrial Product,Win course hear section summer view give ago. Author thing according month important anything.,1,20.03,251
489,Cleaning Product,Tell exist third current college its chair. Bad industry amount look no investment southern.,4,58.02,752
490,Cleaning Product,If trip next gun. Per possible fast travel house. Never present these money local also drug factor.,2,14.45,598
