ProductID,Name,Description,CategoryID,UnitPrice,StockQuantity
1,Industrial Product,Represent third practice remember window lawyer. Statement and move.,1,25.02,630
2,Water Tanks,Ok worry least model other effect. Race develop service leave force recognize. Only decide already.,1,26.38,681
3,Water Tanks,"Safe call loss.
Per why almost.
Build tree tree early grow different. Keep top soldier.",1,91.18,534
4,Plumbing Product,Not difficult near church level no police. Thus before special bag. The ok fight alone tree.,3,52.19,416
5,Agricultural Product,Lose air research. Base line program fill soldier. Second sound common better note.,4,65.51,506
6,Agricultural Product,Current single add them couple middle. Again five report back evening draw. Their near score.,3,24.13,719
7,Cleaning Product,True how network what. Drug couple over. Window name leave direction fine.,2,21.1,134
8,Agricultural Product,Son wife later book nation. Financial space law question modern parent still while.,2,94.46,881
9,Water Tanks,Economy entire among meet lot quality white. Adult garden operation would benefit seven.,2,61.47,14
10,Cleaning Product,True gun member staff. Anything family top green already sing. My shake girl fall center.,2,72.49,876
11,Agricultural Product,Through else senior control less occur commercial tend. Compare north hotel level.,4,29.9,635
12,Plumbing Product,Few standard both head. Little idea manager term condition all story.,4,29.38,66
13,Industrial Product,Until student huge between raise.,4,17.83,379
14,Cleaning Product,Herself gun state kitchen even region. Southern seat under to describe beyond.,4,93.66,225
15,Cleaning Product,If home beyond when woman mother. Hair table turn response.,4,72.11,108
16,Plumbing Product,Better discuss require today sometimes. Upon hot power subject old cultural. Take data allow idea.,2,23.37,696
17,Industrial Product,Response wear today put much low mother. Individual institution rich.,3,29.88,217
18,Industrial Product,Air author set her Mrs and form.,4,71.0,916
19,Cleaning Product,Certainly crime money couple. International company off civil strong contain we.,3,19.19,202
20,Plumbing Product,Sea who clear friend expert guy station. Record bag assume. Employee these cover.,1,86.99,150
21,Industrial Product,Yes life keep significant throw. Board suggest item country benefit hour civil.,1,52.33,295
22,Plumbing Product,Time require grow various it civil service theory. Minute statement here.,3,37.97,522
23,Industrial Product,Heart actually service choice. Realize industry education glass various fall environmental.,2,94.52,300
24,Plumbing Product,Gun score appear carry TV. Nation teacher age chair order.,1,23.18,394
25,Water Tanks,Only national student consider debate produce.,2,78.21,741
26,Industrial Product,Language today nature research professor sign. Rest event great challenge move pattern her off.,2,83.92,248
27,Water Tanks,Necessary avoid seek white group stop. Peace break address manage.,4,75.36,291
28,SANITARY PRODUCT,Sell me hot popular.,4,37.67,980
29,Cleaning Product,Seven order music. Bar bank word whatever me speech where change. Growth support occur assume.,4,49.3,649
30,SANITARY PRODUCT,Agent hundred election. Blue best pattern even.,2,50.32,839
31,Water Tanks,Station home world audience.,3,80.44,851
32,Plumbing Product,Voice do town easy. Today cut doctor several nothing six.,3,14.48,972
33,Industrial Product,Require old born value bad good head. With trial ask structure option administration ability when.,4,80.19,415
34,Water Tanks,Sense body when officer toward third. Report character week local because forward.,2,54.65,841
35,Agricultural Product,They responsibility western make pull. Process message organization hotel what four room owner.,3,19.08,375
36,Plumbing Product,Exist PM hotel here. Tough into real. Word entire radio argue amount.,1,58.18,555
37,Cleaning Product,May group memory find hope treat war.,4,26.6,910
38,SANITARY PRODUCT,Clearly drug from forward. Loss movement born budget carry.,4,99.78,131
39,Agricultural Product,Care special early national five. Century method should.,1,34.49,18
40,Agricultural Product,All behavior learn above. Knowledge white agency street accept guy.,4,29.85,34
41,Industrial Product,Teach society success more short whatever quickly hit.,3,48.11,913
42,Plumbing Product,Financial president yes. Already almost southern us school line. Most exist born get.,3,14.84,351
43,Plumbing Product,Reality lay whether American. Shoulder wonder certain.,1,26.42,615
44,Industrial Product,Those artist option most able support image power. Republican theory know soldier blue.,4,33.05,173
45,Plumbing Product,Reduce edge pay act. Big movie guy since week very everything painting.,4,90.89,785
46,Industrial Product,Quite number executive fall. As challenge happen price technology find why.,1,77.07,177
47,SANITARY PRODUCT,Cold down she recently avoid yes may. Clearly health degree record.,3,20.7,238
48,Water Tanks,Remain special risk guess. Account hospital lose know white toward.,2,50.4,1
49,Cleaning Product,Game able star no your plan area. Reveal security community stand.,3,69.24,881
50,Water Tanks,Rather ok various truth apply before third. Determine media information south check.,2,43.33,169
51,Cleaning Product,Human significant yourself but. Stock carry clear.,1,73.63,909
52,Cleaning Product,At follow none.,2,43.19,162
53,Industrial Product,House century over. Though hold finally explain. Per official ask step along phone.,2,52.79,425
54,Plumbing Product,Environment author a expect light free. Live offer mind amount.,3,26.69,281
55,Agricultural Product,"How agree floor only. Home next owner activity white democratic expert.
Term shake Mr against.",3,73.25,274
56,Agricultural Product,Far only law event million ask.,3,70.32,505
57,Agricultural Product,Office all fly hard three. Nor PM nation speech why.,2,51.27,178
58,Cleaning Product,Certain room what improve. Week million very try listen skin most. Last weight east deal political.,4,44.57,100
59,SANITARY PRODUCT,Dinner bad reality country add. Never not line evening how chance leg.,3,41.4,923
60,Plumbing Product,Between human court alone.,2,30.87,13
61,Cleaning Product,Hot than foreign body green region price. Author wife range option yourself sense.,1,15.3,590
62,Water Tanks,Style produce test relate close road include. Recognize day hand local blue per including.,2,28.3,177
63,Industrial Product,Poor step great person least. Court give over consumer girl.,3,58.11,385
64,Plumbing Product,Degree fund fire building center use article save. Than factor scientist close force.,2,58.96,148
65,SANITARY PRODUCT,Believe grow skill boy. Walk soldier religious street middle plan they seven.,2,92.62,485
66,Agricultural Product,Safe wind notice claim himself travel. Unit word science suggest fine charge piece.,3,41.55,844
67,SANITARY PRODUCT,Our top day get bag. Democratic range right box her would.,3,28.26,284
68,Water Tanks,Recognize specific power me single clearly. Feel kitchen tough prove different majority.,4,21.76,991
69,Industrial Product,People be parent help beat organization. Fish for where exactly.,4,57.47,458
70,SANITARY PRODUCT,Mention between message. Occur bar do. Available hair thus option grow.,3,28.85,771
71,Industrial Product,"Before include purpose blood.
Good senior long gas clear get. Big position rule manage room.",3,98.46,433
72,Water Tanks,Red billion million own heart. History budget scene success recently someone.,3,52.4,141
73,Water Tanks,Girl over skin short our. Weight call likely international as.,2,26.25,547
74,Plumbing Product,For agree teacher Republican. Between operation do. Approach south scientist never must.,1,43.99,478
75,Water Tanks,Turn born stop defense other. Happen long which serve example course.,2,74.88,303
76,Industrial Product,Discuss keep beat decade analysis act.,4,55.93,577
77,Agricultural Product,Appear point back billion board mouth push. Either affect school girl camera.,2,96.02,182
78,Cleaning Product,Similar tree pay special account Congress. Data away main save word although.,4,86.96,968
79,Industrial Product,Writer use course movie take word recent join. Design resource staff tree kind dream.,2,97.87,783
80,Plumbing Product,Growth rule offer feeling girl realize least. Between herself western edge but.,4,37.52,280
81,SANITARY PRODUCT,Beat hundred spring business series military. Onto hard wrong get front.,2,21.1,643
82,Industrial Product,Say attention expect girl. Recently official write good rich result.,4,39.91,906
83,SANITARY PRODUCT,Live suddenly soldier type list later. Human media billion often one.,1,28.49,983
84,Industrial Product,A situation something realize scientist through. Town kitchen live concern magazine bit add.,2,86.72,445
85,Agricultural Product,Production open soon. Song pattern assume camera fish send.,3,86.63,866
86,Agricultural Product,Several argue age meeting happen some carry.,4,65.81,579
87,Cleaning Product,Occur sure young trade authority style. World expect together figure be future until.,1,74.66,853
88,Industrial Product,Six popular worker way. Large tend any issue music interesting.,3,12.79,907
89,Industrial Product,Full radio beyond fund her. Sport improve letter become machine open. Almost sort school something.,2,66.11,280
90,Plumbing Product,South understand on wide. Culture almost nature third onto ago American. Fill focus than huge.,4,18.91,421
91,Water Tanks,Share hundred employee enjoy. Sit Congress that.,4,68.84,867
92,Agricultural Product,Series happy young military enjoy discuss. Staff forget on occur purpose must. Develop wind yeah.,2,62.94,310
93,Cleaning Product,Attention project contain election look culture. Say sell focus once. Support window watch road.,2,39.18,143
94,Water Tanks,North single born more player fund skin. Fear main media data.,1,29.97,24
95,Industrial Product,Speak interesting red success people.,4,79.01,277
96,SANITARY PRODUCT,Under health pressure over family field site. Them system box worker their wall report.,4,27.33,438
97,Plumbing Product,History well far sound outside difference. Cost above own seat defense story girl better.,1,71.14,697
98,SANITARY PRODUCT,Sport area early attorney response skin. Short protect certain sell world into bag maintain.,1,93.6,52
99,SANITARY PRODUCT,General eat record a. Majority young position pay price professional.,1,81.1,756
100,Plumbing Product,"Tell plant card stock close type. Small here some remember.
All stay available language reality.",4,66.27,773
101,Cleaning Product,Several political wall fish on station dream. Both ever beat.,4,73.28,131
102,Industrial Product,Specific rock front either. List control free.,2,51.68,773
103,SANITARY PRODUCT,Year yeah class what. Tend western prevent method next three. Truth care contain.,3,43.19,961
104,Cleaning Product,Ask after window suddenly. Put leave clearly create girl if.,4,59.56,299
105,SANITARY PRODUCT,Box from social medical executive himself line. To change world movement. Cold player future.,3,65.7,788
106,Cleaning Product,Thus when population mind hand article season. Face ability next great. Country what single item.,1,86.55,710
107,Cleaning Product,Although far herself bar fly manager alone interview.,2,14.26,639
108,Plumbing Product,Star finally white student body word. Music attention certainly still goal.,2,82.46,480
109,Industrial Product,Because skill middle leader. Difference win resource Congress.,3,83.39,388
110,Cleaning Product,Strategy politics cultural degree certain purpose. Collection tax why treat enjoy.,1,66.21,897
111,Industrial Product,Smile traditional while chance price list.,1,98.35,937
112,Plumbing Product,Ten doctor help security example.,2,91.01,729
113,Agricultural Product,He less floor source. Foot participant front north. Car list any bar result ever.,4,64.9,718
114,Plumbing Product,Staff offer soldier be important charge world. No sea station position.,2,59.31,458
115,Cleaning Product,Tell remember improve until size different pass.,4,31.96,240
116,Industrial Product,Evening after fight learn. Service turn shoulder last decade free ever.,1,83.31,715
117,SANITARY PRODUCT,Hour until medical something phone.,4,16.38,763
118,Water Tanks,What Mrs during suddenly pretty.,2,77.08,409
119,SANITARY PRODUCT,Though information customer eat. Card position traditional model my them pass.,3,27.04,334
120,Plumbing Product,Radio white local. Seem make discussion why as machine turn.,4,62.28,693
121,Water Tanks,Attorney benefit case seat. Manager physical threat until almost.,1,24.04,216
122,Agricultural Product,Space change however step. Then catch risk city behind. Image hope skill see high girl.,1,95.68,154
123,Industrial Product,Without stop real party.,1,37.88,480
124,Agricultural Product,Represent catch although unit economy growth. Ready example they live give.,1,49.84,487
125,Cleaning Product,Seek agreement process adult campaign remain with. Wife go chance sell become so.,3,87.52,941
126,Plumbing Product,Common that note several. Issue else nearly season staff.,2,42.85,740
127,Water Tanks,Ahead difference collection low current role. Full occur want during like organization country.,4,60.71,164
128,Agricultural Product,Technology indicate raise anyone can. Represent recognize product others again.,3,21.36,438
129,Agricultural Product,Low fall card bank certain to. Attack tax color. At magazine above yard inside.,4,32.55,114
130,Plumbing Product,He although about star personal will couple. Argue citizen rock mind by bed.,1,66.18,717
131,Water Tanks,Stock loss road institution mission. One boy already free push. Image summer ground but cup fine.,2,14.48,283
132,Agricultural Product,Past change performance friend. Quality more exactly half.,2,55.27,109
133,Cleaning Product,What else card condition break meet. Federal sea southern toward relate house.,3,57.77,126
134,Plumbing Product,Have military tough remain agency show week.,1,49.0,32
135,Agricultural Product,Single piece save pattern system. Job past often support of.,2,97.19,249
136,Cleaning Product,Smile daughter sometimes claim kid exist concern. Company natural garden leave control.,3,25.04,489
137,Water Tanks,Wide stock tell century. Senior prevent senior officer.,1,31.07,304
138,Plumbing Product,Specific every loss natural. Couple get space growth appear theory.,4,63.34,410
139,Cleaning Product,Game threat former never. Answer example range human.,2,54.11,933
140,Water Tanks,Everybody rise car many.,1,22.48,583
141,Plumbing Product,Rate southern place ask notice author. Along set lot color threat whole student above.,4,61.93,721
142,Water Tanks,Future realize defense. Like forget stay season speech especially.,3,27.65,673
143,Cleaning Product,Wind serve catch citizen speak.,2,11.82,737
144,Plumbing Product,Worry director such size about. Hear her Mrs use either she free face.,1,70.12,295
145,Industrial Product,Population home north thus evening young. Stuff daughter population speech claim.,2,11.72,562
146,Industrial Product,But marriage sure agreement citizen firm. Top quality friend stop.,4,46.53,730
147,Industrial Product,"Alone short story nor kitchen.
His our change nothing.",4,86.39,11
148,Water Tanks,Crime mention against oil system use.,3,52.98,282
149,Cleaning Product,Visit be policy. Say war try item. Home begin four near after.,1,70.54,362
150,Cleaning Product,Teacher unit address agent red. Personal item already pressure.,3,60.98,184
151,Water Tanks,"Lay newspaper dog consumer least.
Dream throughout notice hope until.",1,14.28,436
152,Industrial Product,Morning crime much right open. Management meeting sing ten.,3,56.03,31
153,SANITARY PRODUCT,Bit station beat way campaign home maintain. Industry fund buy pull exactly.,1,55.48,758
154,Agricultural Product,Financial feel information power population nation. Green chair piece create relationship measure.,1,27.84,462
155,SANITARY PRODUCT,Environmental word mother if under. World against outside specific door thing shoulder.,3,64.53,590
156,Agricultural Product,Hospital turn skill agent stock. Wish exactly also offer.,1,59.97,705
157,Agricultural Product,Accept result guy. You consumer economic value think write forget.,4,48.98,183
158,SANITARY PRODUCT,Population no line sure most guy machine. Guy woman film machine. Reach apply leave charge.,1,22.03,64
159,Industrial Product,Ever fund phone have kitchen. Form trade artist. Condition check run billion understand.,3,89.05,642
160,Industrial Product,Kid measure support my. Myself air success recently. Pay brother reflect open approach build.,1,20.56,107
161,Industrial Product,"Nation point stuff couple people. Range firm language today back.
Note compare fish drop perhaps.",2,32.19,531
162,Water Tanks,Light third national movement whether. Local summer too third radio crime issue.,3,31.89,180
163,SANITARY PRODUCT,"In old great both issue lot face else.
Send turn cover test. Situation prepare upon art ball more.",2,86.3,178
164,SANITARY PRODUCT,Fear tend society some while prove nation. Sure pull pass price speak garden order.,1,16.45,378
165,SANITARY PRODUCT,Worry identify carry artist pull. Piece physical next send blood. Through reason then style.,4,90.45,663
166,Cleaning Product,Seem thought government result there good. Strong industry identify today all spend.,1,48.04,520
167,Plumbing Product,Size music add score pressure happen. Community story avoid from.,4,60.11,129
168,Plumbing Product,Child benefit play. Throughout challenge than eight today it.,1,97.32,162
169,Water Tanks,Get very represent force. A body through food just gun. Mrs name huge parent size.,4,35.5,390
170,Plumbing Product,Move adult today grow. Situation maybe camera design form word exactly.,4,17.77,174
171,Cleaning Product,Nature maybe important recently well. Including meeting list line.,2,27.08,827
172,Water Tanks,Effect rich notice. Thing industry three cup. Attack today ahead yourself.,4,59.47,946
173,Plumbing Product,Training gun evidence dark fund. Majority easy person city job rule enough.,1,34.63,907
174,Water Tanks,Deep every commercial hair sing hope main. Loss apply happy recently.,1,73.93,534
175,Water Tanks,Skin food article movement most choice how.,3,22.29,622
176,Industrial Product,Issue stand single ten. Job car culture eat arm. Figure food school trip country weight.,2,76.03,545
177,Agricultural Product,Detail million generation be support.,3,49.76,339
178,SANITARY PRODUCT,Second system life lose administration. Kind suggest response I fund history.,3,76.93,90
179,Water Tanks,We white effect organization myself. Buy edge I.,1,91.34,285
180,SANITARY PRODUCT,Blue traditional wind. Budget prevent clearly history two billion. Work trouble human or great.,3,26.28,689
181,Water Tanks,Summer say almost certainly sort. Foot forward bag wife figure generation.,4,97.71,484
182,Plumbing Product,She capital prevent agent view peace. Type give kid the attack her us.,3,81.08,944
183,SANITARY PRODUCT,Protect specific want news successful near if. Score minute phone perhaps near keep research.,4,29.06,400
184,Water Tanks,Land suddenly possible firm goal. Hand forward evening large suggest.,1,19.81,798
185,Cleaning Product,Early remember my edge. Production couple today ten source environmental rather cut.,2,88.52,212
186,Agricultural Product,Career traditional assume gas. Letter theory happy still. Which senior computer order.,3,84.77,837
187,SANITARY PRODUCT,List water green support system base thousand. While since economic good. Leader letter majority.,4,37.35,804
188,Agricultural Product,Expert power message green side.,4,94.2,179
189,SANITARY PRODUCT,Include agreement rule. Simply themselves night science interest course size.,4,98.72,862
190,Industrial Product,Follow quite box idea again education minute. People part information TV itself star.,1,85.48,437
191,Agricultural Product,So sure week color. Though thought poor continue. Clear above political image.,2,35.94,292
192,Water Tanks,Media policy rise under camera Republican baby. Stay carry professional phone.,3,24.74,227
193,Water Tanks,Real nice use professional include. Prepare once owner gas help involve sign over.,4,60.69,767
194,Plumbing Product,Never wall street role control project appear. Light include deep site.,4,68.93,794
195,Industrial Product,Another baby green both side marriage author health. Allow hit difference event no new.,2,73.09,123
196,Industrial Product,Yourself require physical structure game mother forget thing. Listen among look development hard.,2,28.06,189
197,Cleaning Product,Skill energy notice person reality seven east. Best hot home in training lay leader government.,1,31.29,111
198,Industrial Product,Data activity control several management art ok.,1,42.1,872
199,Plumbing Product,Just position yes brother. Only number leave.,4,28.81,386
200,Water Tanks,Nor memory rise thought necessary. Group exist baby most follow traditional amount require.,2,17.03,752
201,SANITARY PRODUCT,Attention must reason yet born.,2,39.71,403
202,Water Tanks,Collection policy event charge might career gas. Rule trip tree two purpose public arm Democrat.,2,91.87,207
203,Agricultural Product,Factor year well close production choose let. Whether shoulder than score hard former.,3,11.86,399
204,Water Tanks,Growth occur so treat. Help increase stage film every. Radio TV outside bad keep research.,4,16.32,73
205,SANITARY PRODUCT,Occur admit stuff. Themselves policy model opportunity matter visit.,3,33.48,998
206,Cleaning Product,Pull pass page someone. House avoid national address college military.,3,93.02,988
207,Agricultural Product,History yet ahead arrive.,1,12.27,248
208,Cleaning Product,Weight really debate road. Really store fill. Street rule begin fly.,1,66.84,145
209,Plumbing Product,Effort practice stuff than manager nation party. This together teacher parent memory.,4,56.17,401
210,Industrial Product,Room newspaper strategy stand class may. Civil air born me about cell.,4,90.33,813
211,SANITARY PRODUCT,Drug consider close no part. True eight analysis meet today yeah view.,2,99.95,761
212,Water Tanks,Protect finish significant white. War reason employee son Democrat laugh include.,3,73.87,397
213,Water Tanks,"Material add I.
Wonder recent magazine almost receive. Data along down adult.",3,53.32,79
214,Plumbing Product,Letter draw right prevent argue eye away international. Million identify walk.,1,63.07,952
215,SANITARY PRODUCT,That dark beat have. Necessary impact kind stuff air. Better very civil energy buy audience.,4,39.19,318
216,Water Tanks,Seek education stop federal single involve time week. Anyone technology term collection.,1,73.02,91
217,Industrial Product,Worker under organization such. Police goal do. Eye very out surface similar national most want.,4,99.61,298
218,SANITARY PRODUCT,Benefit stand expert from. Glass reason window despite can.,1,51.4,391
219,Water Tanks,Whatever agent more onto. Network just him between bar. Bit reveal guess.,2,13.43,316
220,Water Tanks,Police natural require would. Analysis how answer cold perform treat miss guess.,1,70.26,957
221,SANITARY PRODUCT,Site budget writer site only. Hold minute upon most play most.,3,16.95,106
222,Agricultural Product,Oil practice perform site hotel. City trial itself gun support paper.,1,96.83,212
223,SANITARY PRODUCT,Wrong pull name president. Six get particular indeed whatever ask shake this.,1,47.9,99
224,Water Tanks,Leave so region. Surface wrong know evidence.,2,39.83,968
225,Cleaning Product,Impact cultural bill indicate inside. Another trouble phone air. Quality media address.,1,90.4,932
226,Plumbing Product,Individual success several base let involve. Quite set main risk need money citizen.,3,49.83,605
227,Agricultural Product,Participant information there thought. Series hour close.,3,76.29,626
228,Plumbing Product,Plan into head among. Remember either investment stand live possible.,2,88.17,821
229,Cleaning Product,Focus then star kid stage add music foreign. Popular music pretty any technology.,1,87.85,925
230,Industrial Product,Pretty finish coach on alone. Third near important executive sound. Teach air clearly real.,4,23.13,869
231,Industrial Product,Education TV scientist year. History different force four.,1,77.44,81
232,SANITARY PRODUCT,Impact wait money worker door responsibility seven. Collection dog level include seat how.,3,12.96,659
233,SANITARY PRODUCT,Lay son generation parent state claim. Mean letter would exactly good. Science main response deep.,1,48.14,484
234,Agricultural Product,Agency dog lot carry. Room magazine often task particularly.,3,20.38,384
235,Cleaning Product,Force build star collection compare store capital. Test five drug suggest positive pay sister.,2,30.07,210
236,Water Tanks,Family several option believe. Approach suffer particularly system.,1,39.01,114
237,Water Tanks,Long information across read. Area way prove between talk. Standard control help evidence seem.,1,21.34,694
238,Cleaning Product,Simply little life always. Tonight movie ten compare option have experience series.,2,65.26,136
239,Plumbing Product,Ability draw quality hour parent strategy. Close spend meeting against.,2,80.19,685
240,Agricultural Product,Beautiful practice fall soldier rich wall. Capital throughout kitchen draw media back.,3,77.01,986
241,Plumbing Product,Six employee admit authority.,3,39.85,769
242,SANITARY PRODUCT,"Forget economic would less rather word.
Among daughter source fear. Such religious similar pass.",1,68.84,985
243,Water Tanks,Hand hand according door care born. Doctor hospital television successful office college customer.,1,72.23,196
244,Industrial Product,Region blood management keep according law or. Will beyond choose care radio major.,4,34.73,576
245,Cleaning Product,Billion tend like. Power class become. Middle pass performance talk last.,4,22.98,347
246,SANITARY PRODUCT,Without hospital audience conference bed trade determine.,3,50.84,308
